{
  "format": "hfd-study-packet",
  "formatVersion": 1,
  "title": "Blank notes",
  "questions": [
    {
      "id": "q1",
      "type": "single-choice",
      "question": "Choose the invented label Quill",
      "choices": [
        {
          "id": "a",
          "text": "Quill"
        },
        {
          "id": "b",
          "text": "Plinth"
        }
      ],
      "correctChoiceId": "a",
      "explanation": "Invented."
    }
  ],
  "guide": {
    "sourceNotes": " \n\t "
  }
}
